事業所番号,ｻｰﾋﾞｽ種類,事業所名,事業所郵便番号,事業所所在地,事業所電話,事業所FAX,指定後状態名,指定年月日,法人名,法人所在地
0821800166,共同生活援助,慈光ホーム,3060504,茨城県坂東市生子1617,0280-88-0301,0280-88-1178,提供中,2006/10/1,社会福祉法人　慈光学園,茨城県坂東市生子1617
0821900107,共同生活援助,すばる,3001237,茨城県牛久市田宮三丁目1番地18,029-873-8883,029-886-5161,提供中,2006/10/1,特定非営利活動法人　おおぞら,茨城県牛久市田宮三丁目1番地18
0822000196,共同生活援助,自然生ホーム,3004211,茨城県つくば市臼井1623-18,029-866-2192,029-866-2192,提供中,2006/10/1,特定非営利活動法人　自然生クラブ,茨城県つくば市臼井1623番地18
0822000220,共同生活援助,サバー,3002645,茨城県つくば市上郷7563-67,029-875-5251,029-875-5341,提供中,2006/10/1,社会福祉法人創志会,茨城県つくば市上郷7563番地67
0822000253,共同生活援助,こだまホーム,3001252,茨城県つくば市高見原2-8-68,029-874-1197,029-874-1197,提供中,2006/10/1,社会福祉法人　ふたば会,茨城県つくば市高見原2-8-12
0822100087,共同生活援助,グループホーム　はまぎく,3111231,茨城県ひたちなか市柳沢2840-1,029-264-1411,029-264-1422,提供中,2006/10/1,社会福祉法人はまぎくの会,茨城県ひたちなか市柳沢字坂下2831
0822200069,共同生活援助,中台育心園,3112213,茨城県鹿嶋市中431-20,0299-69-2222,0299-69-2237,提供中,2006/10/1,社会福祉法人みのり会,茨城県鹿嶋市大字中431番地20
0822200077,共同生活援助,鹿島育成園生活支援センター,3140016,茨城県鹿嶋市国末1539-1,0299-82-6464,0299-83-3261,提供中,2006/10/1,社会福祉法人　鹿島育成園,茨城県鹿嶋市国末1539番1
0822600078,共同生活援助,くりの木,3110117,茨城県那珂市豊喰1152-1,029-295-7652,029-295-7681,提供中,2006/10/1,医療法人社団　有朋会,茨城県那珂市豊喰５０５
0822700126,共同生活援助,ピアしらとり,3080862,茨城県筑西市小塙861,0296-25-0833,0296-22-5973,提供中,2006/10/1,社会福祉法人　征峯会,茨城県筑西市上平塚５９０－１
0822700134,共同生活援助,さぽーとハウス　けやき,3010902,茨城県稲敷市上根本3551,0297-87-0021,0297-87-0023,提供中,2006/10/1,医療法人精光会,茨城県稲敷市上根本3474番地
0822700167,共同生活援助,下館ﾒﾝﾀﾙｻﾎﾟｰﾄｾﾝﾀｰ,3080843,茨城県筑西市野殿1137番地4,0296-24-5540,0296-24-5540,提供中,2006/10/1,医療法人社団　平仁会,茨城県筑西市野殿1131番地
0822700217,共同生活援助,グループホームあんずの里,3080811,茨城県筑西市茂田1735-2,0296-22-5048,0296-24-2078,提供中,2006/10/1,社会福祉法人　慶育会,茨城県筑西市茂田1740番地
0822700274,共同生活援助,太白荘,3000621,茨城県稲敷市阿波１２５９－１,029-894-4567,029-894-3611,提供中,2006/10/1,医療法人社団　広文会,茨城県稲敷市阿波1299
0822800082,共同生活援助,ほびきハウス,3000213,茨城県かすみがうら市牛渡4019-5,029-898-3661,029-898-3760,提供中,2006/10/1,社会福祉法人　明清会,茨城県かすみがうら市牛渡5513-1
0822900197,共同生活援助,鹿島ダルク・シャロームハウス,3140143,茨城県神栖市神栖1-6-26,0299-93-5507,0299-93-5508,提供中,2006/10/1,特定非営利活動法人　ＫＡＳＨＩＭＡアディクションサポートセンター,茨城県神栖市神栖一丁目6番26号
0823100086,共同生活援助,報恩会グループホーム　すだち荘,3113122,茨城県東茨城郡茨城町上石崎4698,029-293-7155,029-293-6062,提供中,2006/10/1,財団法人　報恩会,茨城県東茨城郡茨城町上石崎4698
0823300025,共同生活援助,捜真寮,3191102,茨城県那珂郡東海村石神内宿2382-1,029-306-0068,029-282-1413,提供中,2006/10/1,社会福祉法人　愛信会,茨城県那珂郡東海村石神内宿1213
0823300033,共同生活援助,共同生活援助事業所　幸の実園,3191102,茨城県那珂郡東海村石神内宿1213,029-282-0644,029-282-0433,提供中,2006/10/1,社会福祉法人　愛信会,茨城県那珂郡東海村石神内宿1213
0824200034,共同生活援助,あじさいホーム,3003561,茨城県結城郡八千代町平塚4799-1,0296-48-2924,0296-48-2924,提供中,2006/10/1,社会福祉法人　共生社,茨城県古河市鴻巣1179
0827100033,共同生活援助,つばさ,3004426,茨城県桜川市真壁町下谷貝375-2,0296-55-0928,0296-55-0917,提供中,2006/10/1,社会福祉法人　紫峰会,茨城県桜川市真壁町下谷貝1595-2
0827300021,共同生活援助,グループホーム　ボランペの家,3002307,茨城県つくばみらい市板橋2147-4,0297-57-0756,0297-38-6551,提供中,2006/10/1,社会福祉法人ゆっこら,茨城県龍ケ崎市字古城3204番地
0827400045,共同生活援助,グループホーム玉里の里,3113433,茨城県小美玉市高崎冨士峰1824-500,0299-27-0002,0299-27-1181,提供中,2006/10/1,社会福祉法人　聖隷会,茨城県小美玉市高崎2206-1
0827100108,共同生活援助,真壁厚生学園,3004422,茨城県桜川市真壁町亀熊852,0296-54-2578,0296-54-2577,提供中,2006/7/1,社会福祉法人　筑紫会,茨城県桜川市真壁町亀熊1464-1